URL;datetime;heading;text;newssite
https://www.thestandard.com.hk/breaking-news/section/4/196909/Teacher-arrested-for-false-reports-of-school-abuse  ;2022-11-09 13:08:00; Teacher arrested for false reports of school abuse The Standard;" A female teacher at a special school was arrested for falsely reporting faculty abuse of students due to dissatisfaction with her work. Police announced today to arrest of the 48 year old teacher of Hong Chi Pinehill No.2 School on Monday on suspicion of publishing anonymous letters falsely claiming to be a student's parent and reporting that her child was being abused by the school. In October this year, the Education Bureau said it received complaints from parents that revealed long period physical child abuse accidents in the school, including faculty tying up children's hands and suffocating them by putting a towel over their faces, with video clips attached. The involved school, Hong Chi Pinehill No 2 School, released a statement afterward to deny the mistreatment, saying receiving parents' contact to clarify the misconduct toward children by teachers was not true. After several investigations, officers found that the abuse allegations were exaggerated and false. No child abuse was detected as officers investigated around 19,000 hours of the school's camera surveillance footage from June to August this year. The video clips attached to the letters, which claimed to record the children's abuse scene, were found to have been made four to eight years ago. We noticed that the content of the anonymous letters was directed at the school's management board, said the police, we believed the person who wrote the letters was dissatisfied with the school's staff. The arrestee, who has been working as an English teacher in the school for more than 10 years, is now detained with police finding a computer and a printer in her office, which were believed to be used for making the anonymous letters.  Today's Standard Trademark and Copyright Notice: Copyright 2022, The Standard Newspaper Publishing Ltd., and its related entities. All rights reserved.
Use in whole or part of this site's content is prohibited. Use of this Web site assumes acceptance of the Terms of Use, Privacy Policy Statement
and Copyright Policy.Please also read our Ethics Statement.";The Standard
https://hongkongfp.com/hong-kongs-chief-executive-elections-2022/;2022-06-08 18:28:00+08:00; Hong Kong's 2022 small circle Leadership election; Hong Kong Free Press HKFP Hong Kong news – Independent, impartial, non profit Hong Kong's next leader will be decided by the 1,461 current members of the Election Committee on May 8. Electors were vetted last year by a committee led by the sole candidate – ex chief secretary John Lee. Loading Something went wrong. Please refresh the page and/or try again. Loading Something went wrong. Please refresh the page and/or try again. Loading... Something went wrong. Please refresh the page and/or try again. Loading... Something went wrong. Please refresh the page and/or try again. Views expressed by opinion writers and advertisers are not necessarily shared by HKFP.;Hong Kong Free Press
https://hongkongfp.com/2020-legislative-elections/;2022-11-09 18:22:00+08:00; 2021 Hong Kong Legislative Election; Hong Kong Free Press HKFP Hong Kong news – Independent, impartial, non profit Loading Something went wrong. Please refresh the page and/or try again. In March, 2021, Beijing passed legislation to ensure 'patriots' govern Hong Kong. The move reduced democratic representation in the legislature, tightened control of elections and introduced a pro Beijing vetting panel to select candidates. The Hong Kong government said the overhaul would ensure the city's stability and prosperity. But the changes also prompted international condemnation, as it makes it near impossible for pro democracy candidates to stand. There is putting a brave face on bad news, there is spin, and there are outright falsities. All three were on offer after the latest Legco elections, spurned by more than 70 percent of the registered voters. See also: Democracy is never going to be a one size fits all solution The South China Morning Post treated the The official White Paper on 'Hong Kong Democratic Progress Under the Framework of One Country, Two Systems,' released on December 20, 2021, affirmed that during the British colonial administration, there was no democracy in Hong Kong. The Central Political Committee devised the 'One Country, Two Systems' policy in early 1980s, and it is the backbone Loading Something went wrong. Please refresh the page and/or try again. Loading Something went wrong. Please refresh the page and/or try again. Support HKFP    Code of Ethics    Error/typo?    Contact Us  Newsletter   Transparency & Annual Report Support press freedom & help us surpass 1,000 monthly Patrons: 100% independent, governed by an ethics code & not for profit, Hong Kong Free Press is #PressingOn with impartial, award winning, frontline coverage. Loading... Something went wrong. Please refresh the page and/or try again. Loading... Something went wrong. Please refresh the page and/or try again. Views expressed by opinion writers and advertisers are not necessarily shared by HKFP.;Hong Kong Free Press
https://hongkongfp.com/hong-kong-free-press-annual-report-2021/;; Hong Kong Free Press Annual Report 2021; Hong Kong Free Press HKFP Hong Kong news – Independent, impartial, non profit Our latest Annual Report includes a Transparency Report based on our latest yearly, independent audit. Letter from the Editor Dear readers and supporters, Over the past year, the HKFP newsroom underwent a transformation – we expanded, professionalised, moving to a new, larger, private office. We doubled our freelance budget, hired three new staff, won a SOPA award, and produced almost 150 fully fledged original features. Our team covered the first 'patriots only' election, Covid 19, the national security law, and we exceeded our Funding Drive target, bringing 1,000 monthly Patrons online. But 2021 was also a brutal year for the media industry in Hong Kong, with newsrooms raided, editors arrested and outlets disbanding in fear. In all, over 60 civil society groups disappeared last year, all whilst the authorities said press freedom was intact, deeming foreign criticism of journalist arrests a violation of international law. Yet we are continuing our work. HKFP was founded seven years ago as a response to press freedom concerns, but – aside from our 2020 work visa denial – our newsroom has never been directly troubled by the authorities. This is likely owing to our impartial stance, transparent funding, and balanced coverage guided by an Ethics Code and Corrections Policy. Press freedom is guaranteed by the Basic Law, Bill of Rights and security law – it is in our name, and it is on this basis that we operate. For these reasons, HKFP staff are united in our commitment to continue our on the ground award winning reporting. Nonetheless, we cannot be naïve when it comes to ensuring staff safety and security, protecting sources, and trying our best to navigate unclear legal realities whilst test cases go through court. We are a Hong Kong news outlet, we love this city, and we have not entertained the idea of reporting on it from elsewhere. Besides, it is only by being on the ground that we can maintain nuance and accuracy through attending events, press conferences, court cases and speaking directly with Hongkongers. But because of the current uncertainties facing journalists, we may make some precautionary changes this year upon legal advice. Above all though, we will always be guided by the journalistic tradition, our ethics code, and the day to day mission of ensuring accuracy and fairness. And despite recent events, we do not believe there are any Hong Kong stories we would have to avoid reporting. I am happy to present our Annual Report, as we round up our best coverage, achievements, and our accounts from the past 12 months. During this coming year, we look forward to covering the city's leadership race, the 25 th anniversary of the Handover, the pandemic and court cases. And with your support and readership, the HKFP team will continue to hold the line and press on! Our Mission & Impact Founded in 2015, Hong Kong Free Press is an impartial, non profit, award winning English language newspaper. Run by journalists, backed by readers and completely independent, HKFP is governed by a public code of ethics. Best of 2021 Original features: Our features in 2021 documented Hong Kong's transformation under the shadow of the Beijing enacted security law. We delved into how counsellors and psychologists grappled with the fear of creeping self censorship in their practice, how booksellers were reported to the national security police during the Hong Kong Book Fair for selling politically sensitive titles, and how one of the city's last remaining independent bookstores shuttered, citing the political environment. We also looked at how the city's filmmakers, publishers and street artists navigated the shifting red lines, and how some Hongkongers are inking messages of resistance onto their own skin. The city's media landscape forever changed last year with the closure of pro democracy newspaper Apple Daily. HKFP was at its newsrooms and printing presses on its last day of operations. We also explored how the city's Beijing backed press are gaining more influence. The year also saw the mass resignations of pro democracy district councillors after new oath requirements were introduced. We documented the final days of one local councillor in office and explored how the exodus of district representatives also left community newspapers struggling. As protest related and national security cases piled up in the city's courts, we spoke with lawyers compiling a protest case database to preserve the city's rule of law, the activists writing letters to detained protesters, and the international lawyers who launched an advice website to inform Hongkongers of their legal rights. We also spoke with a refugee from Vietnam who was stuck behind bars for almost three decades after being convicted of murder as a teenager, and eventually decided to abandon his fight against deportation. Amid the changes of 2021, a wave of Hongkongers left for the UK. HKFP was at the airport when long queues formed as people bid farewell to loved ones. In the UK, we reported on the people helping newly arrived Hongkongers settle in, as well the pro China groups pressuring them. Hong Kong also saw the implementation of a sweeping overhaul of the city's electoral system. HKFP gave extensive coverage on the day of the city's first 'patriots only' legislative election – candidates made urgent appeal to voters while Hong Kong saw the lowest turnout rate ever. Following a 48 hour purge of Tiananmen Massacre monuments from university campuses over Christmas, we also spoke with students, academics, as well as artists behind the statues about what the removals meant for Hong Kong's efforts to commemorate those who died in the military crackdown of student led demonstrations over 32 years ago. Our team visited local businesses at risk of forced closure after government led redevelopments in Fo Tan and Kwun Tong. Elsewhere, we spoke with the owners of Hong Kong's remaining iconic Dai Pai Dongs facing eviction from their community, and the elderly villager fighting to save his home from developers in the New Territories. We also reported on the opening of the newly revamped historic Central Market and the long awaited M+ museum. Covid 19 restrictions continued to disrupt Hongkongers' daily lives last year. We examined government statistics to question whether the city's severe quarantine measures were really necessary, how even vaccinated people were forced into quarantine centres, how foreign domestic workers faced more challenging working conditions during the pandemic, and the rise in discrimination against South East Asians. We also delved into the trend of 'vaccine selfies,' how pandemic related pressure on airlines led some pilots to accuse companies of age discrimination, and the plight of those left stranded in the UK during Hong Kong's months long flight suspensions. Our pandemic coverage also tackled how the coronavirus made life even more difficult in the city's sub divided flats, the refugees excluded from the city's vaccination programme, how local mask manufacturers survived in an inundated market, and how local businesses responded to the government mandated tracing app. Beyond politics, we delved into the world of polyamory to explore how some Hongkongers navigate romantic ties beyond traditional partnerships, explored the little known history of siu mai, met the bus fanatics turning Hong Kong bus seats into office chairs, and published a probe into one of the city's oldest sporting associations. We also looked at how a Muslim headscarf sparked a discrimination row at a school and how volunteers helped to restore Hong Kong's Hindu cemetery. 2021 was also a big year for Hong Kong sports. We spoke to local athletes during the Tokyo games to learn about daily life at the Olympic village, as well as to the city's Paralympians about their dreams of sporting glory. We continued to cover environmental and animal stories last year, including the threat to rare porpoises posed by a development off Lantau, and the task force fighting against dog poisonings. Last year, we produced 144 fully fledged features, over 35 interviews, 256 opinion pieces and 276 stories on the 'patriots only' elections. We have also published over 1,000 stories on the national security law, and over 1,000 on Covid 19. HKFP Venture also relaunched with over a dozen guides to outdoor adventures. We expanded our coverage from across the Taiwan Strait, profiling the people fighting for dual citizenship, Hong Kong artists in self exile, the Hongkongers seeking to contribute to Taiwanese society, the launch of an ambitious new English language news platform, and the Hongkongers who have joined the local movement to revive the use of Taiwanese in daily life. We also spoke with the Taiwanese maths teacher posting educational videos on Pornhub, cautiously asking: why? Over the border in mainland China, we reported on a Hongkonger with a history of mental illness who was executed for drug trafficking despite pleas from family and rights groups. And further afield, we reported on the Hongkongers fighting for democracy in Myanmar after the military coup. Explanatory Reporting: HKFP continued its monthly explainer series on how the city has changed under the Beijing enacted security law, and we continued our 'shifting narratives' series on how the city's leaders' attitude towards the Tiananmen Massacre and the traditional mass pro democracy marches on July 1 evolved over recent years. We wrote explainers on major political developments, including how Beijing overhauled the city's electoral system, how authorities moved to erase the memory of Tiananmen, and how the largest teachers' union was forced to dissolve. We also explained how Hongkongers still found ways to resist despite the national security clampdown. HKFP also examined trends in leader Carrie Lam's past policy addresses after she delivered the last one of her current term, analysing what it all meant for the city's future. We broke down how Beijing's overhaul of the city's electoral process ensured that almost every candidate for the new Election Committee was guaranteed a seat. We looked at where Beijing's national security crackdown has left the city's pro democracy camp, and who the approved candidates were in the city's first legislative poll following the sweeping overhaul. Our team also wrote practical guides informing our readers how to sign up for the government's electronic stimulus vouchers, how to enter lucky draws for the fully vaccinated, how to get vaccinated against Covid 19, and how to write letters to prisoners. Interviews: Last year, we touched in again with Chinese dissident artist Ai Weiwei about what he saw as the future of art in the city. We also spoke with Democratic Party leader Lo Kin hei about the party's future in the shifting political climate, and political scientist Ma Ngok on what Beijing's electoral overhaul means for democracy in Hong Kong. At the other end of the political spectrum, we spoke to the founder of the new pro Beijing Bauhinia Party Charles Wong, and pro establishment lawmaker Michael Tien on the future of Hong Kong politics. We also sat down with pro Beijing figure Adrian Ho about running one of the city's largest pro establishment online communities. We spoke with a number of activists before they were put behind bars, including democrat and labour activist Raphael Wong ahead of his sentencing for an unauthorised assembly, and student activist Wong Yat chin before he was arrested and denied bail under the security law. We also spoke to other dissidents, including former student leader Owen Au about what he saw as the future of protest in the city and investigative journalist Bao Choy after her conviction over accessing public records for a documentary on alleged police collusion with triads. We interviewed dissidents elsewhere in the region, including Singaporean activist Jolovan Wham about his arrest after a one man protest. And during the Tokyo Olympics, we were the first newspaper to catch up with Hong Kong's only gold medal winner, fencer Edgar Cheung, about how he kept calm under pressure. Arts: We also sat down with the city's creatives, including the director of the protest documentary 'Revolution of our Times' Kiwi Chow about why he is staying put in the city, musician Cehryl on the impact of Covid on live music, artist Sampson Wong on finding beauty in Hong Kong, and Yim Chiu tong, the Plumber King, whose advertisements became part of a street art exhibition. In Taiwan, our reporter interviewed the island's only weed lawyer, a politician defending democracy on Matsu island 17 km from mainland China, and dissident Wu'er Kaixi ahead of the 32nd anniversary of the Tiananmen Massacre. And we also spoke with Taipei based singer Kimberley Chen about shrugging off China's censors. Authors: We spoke with journalist and author Joanna Chiu about her new book detailing China's web of influence abroad and Western complicity in China's rise, and veteran journalist Stephen Vines about his last book on Hong Kong before he fled back to the UK. 'Patriots poll: Ahead of the city's first 'patriots only' legislative race, we spoke to three candidates from across the political spectrum including self proclaimed non pro establishment Adrian Lau, Vincent Diu, an electrician who declared as independent, and Nixie Lam, who was seen by her pro establishment supporters as their international spokesperson. After the race, we also sat down with Tik Chi yuen, the only lawmaker elect who claimed to be non pro establishment. Scoops: We broke the story of how mainland Chinese and Hong Kong Wikipedia users were fighting over the narrative of the Hong Kong protests on the site, and the ensuing safety concerns for Hong Kong users. As a result of our report on the Wikipedia wars, the site banned seven mainland Chinese users for 'infiltration and exploitation.' We found Hong Kong public libraries had removed almost a fifth of titles relating to the 1989 Tiananmen Massacre from their shelves since 2009, and that the Bar Association had launched probes into legal icons Martin Lee and Margaret Ng after their convictions for unauthorised assembly. We also broke the story of how city authorities spent millions of taxpayer dollars to lobby Washington against the passing of the Hong Kong Human Rights and Democracy Act. 2020 Achievements NewsStream project complete: In 2019, HKFP won a US$78,400 (HK$615,440) Google News Initiative grant to create an open source funding platform for small newsrooms focussed on nurturing reader membership. The funds went to third party developers to help create NewsStream – a fundraising micro site to reduce barriers and costs for independent news start ups. Our new support.hongkongfp.com site finally launched in 2021, allowing readers to begin, pause and cancel memberships. Redesign & promotion: The launch also included a design refresh across social media and new HKFP Patron promotions by szs.io. 2021 Funding Drive: With an accompanying video, HKFP beat its target of 1,000 monthly Patrons during our #PressingOn Funding Drive. TapNGo: As part of our drive to make it as easy as possible to contribute, we brought TapNGo online, as a new payment method. 2021 expansion: HKFP hired three new staff at the end of 2021 and moved to a larger, private office at The Hive K Town. Prizes: HKFP won an honourable mention in the 2021 prestigious SOPA awards for Excellence in Opinion Writing: 'Hong Kong's protest movement in perspective' by Steve Vines bagged the prize. Meanwhile, our newsroom was nominated for a Nobel Peace Prize. Fundraising: We raised over HK$100,000 selling books by columnist Steve Vines and ethical, organic #PressFreedom t shirts. Placement & Impact Distribution Channels HKFP 2022 Team Transparency Report As Hong Kong's most transparent news outlet, and as a non profit company, HKFP is externally audited annually. Our finalised, audited income during 2020, and our predicted income for 2021: Income: HKFP is predicted to make a monthly loss of up to HK$100K in 2022, but is able to reinvest its previous surplus. Our current revenue streams: Surplus recycled: As a non profit, with no shareholders or investors, HKFP's surplus was recycled back into the company for use in 2021. As of 2021, HKFP is retaining a HK$1.5m legal defence fund in light of new threats to press freedom. Efficiency: HKFP is run as efficiently and prudently as possible, in order to maximise the impact of our donors' generosity. We make savings by partnering with other media outlets, using free software and making full use of teamwork and automation to save on costs. Staffing: During 2020, we employed 5 6 full time staff members and expanded our pool of freelancers. We spent 72% of our income on paying our hard working staff and freelancers. HKFP Patrons in 2021: HKFP relies on a membership model. Small amounts of income from a large pool of Patrons helps support our team, sustain our operations with more security, and guarantee our independence. Our monthly income as of January 2022:   Finalised expenditure for our latest audited year, 2020, & our predicted 2021 spending: HKFP Press Freedom Update Support HKFP into 2022 Not for profit, run by journalists and completely independent, the HKFP team relies on readers to keep us going and to help safeguard press freedom. Donate by cheque Cheques of amounts up to HK$50,000 may be made payable to Hong Kong Free Press Limited and posted – along with your full name and address to: HKFP, The Hive Kennedy Town, 6/F, Cheung Hing Industrial Building, 12P Smithfield Road, Kennedy Town, Hong Kong. [Contributions are confidential – a paper trail is required for our internal accountancy records.] Donate online via card, PayPal, direct transfer to our HSBC account or via FPS: One off or monthly contributions can be made with your Visa, Mastercard, or Apple Pay/Google Pay via Stripe on our website: support.hongkongfp.com. Donate via HSBC PayMe Scan our QR code to make an HSBC PayMe digital payment. Please include your full name and email address so we may accept your contribution. Donate spare coins Hoarding a jar of coins? Donate spare change at Coin Dragon machines around the city. Buy HKFP merchandise Show your support for press freedom with our range of HKFP merchandise. Made in Hong Kong, designed by artist Badiucao. Donate gear or sponsor our operations We welcome contributions of new computer or audio visual equipment. We also welcome sponsorship of our ongoing operational costs – please get in touch if you can support us. Buy HKFP merchandise Show your support for press freedom with our range of HKFP merchandise. Made in Hong Kong, designed by artist Badiucao. 'Tip' us with a micro donation 'Tip' HKFP with a micro donation via Flattr. Advertise with us Support us and promote your business or cause at the same time. Request our rate card and consider our affordable range of digital marketing solutions. Shop at Book Depository HKFP receives a 5% commission if you shop at the Book Depository via bit.ly/hkfpbooks.;Hong Kong Free Press
