URL;datetime;heading;text;newssite
https://news.rthk.hk/rthk/en/component/k2/1674231-20221104.htm;2022-11-04 13:10:00; Rugby Sevens a Covid test for HK: Regina Ip All Local Greater China World News Finance Sport;" Regina Ip says the Rugby Sevens can serve as a test to see whether Covid measures can be relaxed in Hong Kong. File photo: RTHK Executive Council convenor Regina Ip on Friday said officials should consider relaxing Covid measures if there isn't a big increase in infection numbers after this weekend's Rugby Sevens.

At a forum, Ip said the tournament will be a test for the SAR, as many spectators will be eating and drinking at the venue.

If we are able to pass this challenge of the Rugby Sevens tournament, with 26,000 spectators at the three day event and bars operating until very late... if case numbers don't show a huge increase, I believe Hong Kong can further open up conditionally, Ip said.

Meanwhile, a Chinese University of Hong Kong (CUHK) survey suggests most people in Hong Kong want the government to relax anti epidemic measures.

Almost 70 percent of some 700 people interviewed by phone in September and October said they would like to see Covid rules eased, with 20 percent saying the current measures should remain in place and about five percent hoping for even stricter rules.

The CUHK researchers said there is a significant increase in the percentage of people supporting the idea of a relaxation of pandemic measures compared to a similar survey carried out in the same period last year.";Radio Television Hong Kong
https://news.rthk.hk/rthk/en/component/k2/1674217-20221104.htm;2022-11-04 11:34:00; Otto Poon company to be fined in antitrust suit All Local Greater China World News Finance Sport;" Otto Poon's ATAL Building Services Engineering had been under investigation over a suspected air conditioning work cartel. File photo: RTHK A company owned by the husband of former justice secretary Teresa Cheng is facing a fine of tens of millions of dollars after it admitted violating antitrust laws. 

The Competition Commission said on Friday that it had been investigating Otto Poon's ATAL Building Services Engineering over a suspected air conditioning works cartel. 

The commission has proposed a HK$150 million fine, which is subject to approval by the Competition Tribunal.

The watchdog said the company and its parent firm, Analogue Holdings, have pledged full assistance with its probe.

The cooperation agreements entered into with several respondents in the case represent significant developments in the commission's investigation into the multi year air conditioning services cartels, said the commission's CEO, Rasul Butt, in a statement. 

Analogue Holdings, meanwhile, said in a stock exchange filing that it will not be named as a party in the suit. 

It said the company's board decided that it was in the interests of the firm and shareholders to sign an agreement with the competition watchdog.

_____________________________
Last updated: 2022 11 04 HKT 12:46";Radio Television Hong Kong
https://news.rthk.hk/rthk/en/component/k2/1674163-20221104.htm;2022-11-04 00:10:00; Summit ends with HKMA promising another next year All Local Greater China World News Finance Sport;" Summit ends with HKMA promising another next year The Hong Kong Monetary Authority (HKMA) has wrapped up the Global Financial Leaders' Investment Summit, saying it's been so successful there will be another one next year.

In view of the success of the summit, we plan to host the summit again next year, also to coincide with the 30th anniversary of the establishment of the HKMA, said Eddie Yue, the authority's chief executive.

The three day event, held mainly at the Four Seasons hotel in Central, was an initiative announced by the Financial Secretary, Paul Chan, in his budget. Its goal was to showcase Hong Kong as an international financial centre, as it started to emerge from the Covid pandemic.

The summit began on Tuesday with a dinner at M+, the SAR's museum of visual culture. The following day there were speeches, panel discussions, and what was described as a fireside chat. It officially officially ended on Thursday with a programme of Conversations with Global Investors, co hosted by the Hong Kong Academy of Finance. 

The Monetary Authority said the summit welcomed over 200 international and regional leaders from around 120 global financial institutions including banks, securities firms, asset managers, sovereign wealth funds, private equity and venture capital firms, hedge funds, and insurers. 

It said more than 40 of these institutions were represented by group chairs or chief executive officers.";Radio Television Hong Kong
https://news.rthk.hk/rthk/en/component/k2/1674124-20221103.htm;2022-11-03 18:46:00; Glass bottle levy to take effect next year All Local Greater China World News Finance Sport;" The government says the scheme will come into effect in the second quarter of next year. Image: Shutterstock The Legislative Council on Thursday passed a motion to introduce a charging scheme for glass beverage containers in Hong Kong. 

The scheme, which will take effect in the second quarter of next year, is aimed at encouraging bottle suppliers to do more to recycle their containers. 

Under the arrangement, glass beverage bottle importers and suppliers are required to pay a HK$0.98 levy for every one liter bottle they distribute in the city. 

The environment and ecology minister, Tse Chin wan, said the scheme is in line with the city's 'polluter pays' principle, and called it a step forward in environmental protection.

He noted that two glass management companies have already been providing waste glass container collection and treatment services across the territory.

Under the new scheme, bottle importers and suppliers are required to register with the Environmental Protection Department at the start of next year. 

Tse said exemptions will be provided for registered firms which have in place a recovery and reuse arrangement for their beverage bottles. However, they will have to pay an application fee of HK$9,250.

Environmental group Green Earth said officials should also do more to encourage consumers to recycle their bottles. 

The government can introduce a deposit and return system, so that when a consumer buys a bottle of wine, you pay a deposit, then the consumer will try to find ways to return the bottle, the group's founder, Edwin Lau, told RTHK.

DAB lawmaker Elizabeth Quat supported the new charging system, saying she hopes its implementation can improve Hong Kong's overall recycling network.";Radio Television Hong Kong
https://news.rthk.hk/rthk/en/component/k2/1674119-20221103.htm;2022-11-03 18:01:00; HK records 5,245 new Covid infections, 10 deaths All Local Greater China World News Finance Sport;" HK records 5,245 new Covid infections, 10 deaths Hong Kong on Thursday added 5,245 new infections, including 416 imported cases. 

Health officials also announced that another 10 people with Covid have died.

At a press conference, Undersecretary for Health Libby Lee said the government will keep social distancing rules in place for the time being.

Lee said a baby version of the BioNTech vaccine is being delivered to Hong Kong and could be available next week for children aged between six months and five years.
______________________________

USEFUL LINKS
General Covid 19 situation: https://www.coronavirus.gov.hk/eng/
Community Clinics for Covid 19 patients: https://bit.ly/3EiiczC
RAT reporting platform: https://www.chp.gov.hk/ratp/
Vaccination programme: https://www.covidvaccine.gov.hk/sen/
Vaccination pass scheme:https://www.coronavirus.gov.hk/eng/vaccine pass.html 
Hotline for Covid positive patients: 1836 115";Radio Television Hong Kong
https://news.rthk.hk/rthk/en/component/k2/1674100-20221103.htm;2022-11-03 15:23:00; Cause of melioidosis outbreak still unknown: experts All Local Greater China World News Finance Sport;" Cause of melioidosis outbreak still unknown: experts Health experts on Thursday said more than 30 soil samples collected from service reservoirs in Sham Shui Po tested positive for a bacterium that causes melioidosis, but they have still been unable to determine what caused an outbreak in the area. 

The Centre for Health Protection and the University of Hong Kong (HKU) made the conclusion as they wrapped up an epidemiology investigation in Sham Shui Po, following the emergence of a spate of melioidosis infections. 

They found that 38 of the 471 environmental specimens collected in Sham Shui Po contained traces of Burkholderia pseudomallei – a bacterium which causes melioidosis – 32 of which were extracted from the soil in service reservoirs. 

Among the 32 positive soil samples from the service reservoirs... four have undergone genome sequencing. It was found that the genes of these four soil samples are very similar to that of the patients of the Sham Shui Po cluster. We believe there may be a connection, Albert Au from the Centre for Health Protection said, noting however that experts have yet to ascertain the cause of the outbreak.

Au said the government is amending legislation to list melioidosis as a statutory notifiable infectious disease, which will require doctors to report both suspected and confirmed cases. 

Speaking at the same press conference, HKU top microbiologist Yuen Kwok yung said global warming may be to blame for an increase in cases. 

We believe it's related to global warming. Under global warming, the amount of the bacterium in the soil will increase. And this kind of bacterium can survive both low and high temperatures. So we have grounds to believe that with the temperature rising globally, the risk of melioidosis infections will be increased, along with the amount of bacterium in the soil, he said. 

Yuen advised Sham Shui Po residents not to use tap water that comes out within the first minute for showering, washing their face or brushing their teeth.

Melioidosis is transmitted through contact with contaminated soil or surface water, though human to human and person to person transmission is rare. 

A total of 34 cases of melioidosis have been reported in Hong Kong so far this year – 20 of them from Sham Shui Po.";Radio Television Hong Kong
https://news.rthk.hk/rthk/en/component/k2/1674101-20221103.htm;2022-11-03 15:11:00; Local banks raise interest rates after latest US hike All Local Greater China World News Finance Sport;" HSBC's best lending rate will go up to 5.375 per cent. File photo: RTHK Leading local banks HSBC, Hang Seng, Standard Chartered and Bank of China (Hong Kong) on Thursday announced higher interest rates after the latest rate hike by the US Federal Reserve.

HSBC announced a second interest rate increase in more than a month and this time by a larger margin. From Friday, the bank's Hong Kong dollar best lending rate will go up by 25 basis points to 5.375 percent. It was raised by 12.5 basis points in late September. 

Meanwhile, the bank will raise its savings rate for its Hong Kong dollar deposits by 25 basis points. It went up by 12.4 basis points, also in late September.

'The one month and three month Hong Kong Interbank Offered Rates (Hibor) have continued to increase by more than 59 and 152 basis points since we raised our HK dollar best lending rate in September. In deciding the level of adjustment today, we have assessed the implications of recent economic reports, affordability for borrowers, and interest to depositors, said Luanne Lim, chief executive of HSBC Hong Kong.

Hang Seng Bank announced similar rate increases. From Friday, its prime lending rate will go up by 25 basis points to 5.375 percent and its savings rate will be raised by 25 basis points.

Higher rates will take effect at Standard Chartered from Monday. Its prime lending rate will go up by 25 basis points to 5.625 percent, and its savings rate will be raised by 12.5 basis points to 0.375 percent.

Also from Monday, the prime lending rate at Bank of China (Hong Kong) will be raised by 25 basis points to 5.375 percent, and its savings rate will go up by 25 basis points to 0.375 percent.

Meanwhile, the Hong Kong Monetary Authority (HKMA) on Thursday raised its base rate by 75 basis points to 4.25 percent with immediate effect according to a pre set formula, in the wake of the US rate hike by a similar margin.

The HKMA also warned the public about rising borrowing costs here.

Many banks have already raised their saving and lending rates, including the prime rates and the interest rate cap for newly approved mortgage loans. The public should be prepared for the commercial interest rates to rise further, and carefully assess and manage the relevant risks when making property purchase, mortgage or other borrowing decisions, HKMA chief executive Eddie Yue said in a statement.

He also said it's normal for the Hong Kong dollar exchange rate to remain weak as the interest rate differentials between the local currency and the greenback widen.

Financial Secretary Paul Chan said continuous US rate hikes will hit demand for Hong Kong exports.

But he played down concerns about the city's economic growth after advance government estimates showed GDP shrank 4.5 per cent in the July September quarter from a year ago.

The economic situation has been challenging. But if we are able to put Covid 19 under control... if we are able to continue to have travellings between Hong Kong and the rest of the world, that will provide added impetus to our economic growth, said Chan.

The financial secretary also said a recent correction in property prices was expected and that there was no need to ease existing government curbs.
_____________________________
Last updated: 2022 11 03 HKT 18:22";Radio Television Hong Kong
https://news.rthk.hk/rthk/en/component/k2/1674085-20221103.htm;2022-11-03 13:39:00; Covid hit Paul Chan denies getting special treatment All Local Greater China World News Finance Sport;" Covid hit Paul Chan denies getting special treatment Financial Secretary Paul Chan on Thursday rejected the idea that he has been given special treatment, after attending a bankers' summit despite testing positive for Covid.

The government said Chan contracted the coronavirus in Saudi Arabia last week and tested positive via a PCR test after flying back to Hong Kong on Tuesday.

The next day, he attended the Global Financial Leaders' Investment Summit held by the Monetary Authority, with health officials explaining that Chan did not need to be put in isolation as he had recently recovered from Covid and had a low viral load. 

The health authorities looked at my PCR test result, took into consideration the details of my health declaration, also took into consideration the fact that I did not have any symptoms on arrival, Chan told reporters on the sidelines of the summit.

He said other people arriving in the territory after earlier infections have also been allowed to skip isolation.

The treatment I have been given was the same as anyone, there is no particular privilege at all, said Chan. 

The minister also explained why he did not wear a face mask when delivering speeches at the summit.

He said the stage was a good distance from the audience and he had worn a mask at other times.";Radio Television Hong Kong
https://news.rthk.hk/rthk/en/component/k2/1674079-20221103.htm;2022-11-03 13:14:00; Court throws out challenge to jab exemption law All Local Greater China World News Finance Sport;" Kwok Cheuk kin said the health chief should not be given the power to invalidate vaccine exemption certificates, but the court disagreed. File photo: RTHK The High Court on Thursday rejected an attempt to challenge the government's amendment of the law to empower it to invalidate vaccine exemptions. 

The legal amendment was made last month, just days after Justice Russel Coleman ruled that the Prevention and Control of Disease Regulation, in its original form, did not give the Health Secretary the power to void over 20,000 Covid vaccine exemption certificates issued by seven doctors who were suspected of giving them out without properly examining the patients. 

That case was mounted by local resident, Kwok Cheuk kin, who's known as 'the king of judicial reviews' for the number of legal challenges he made against the authorities. 

Subsequent to the law change, Kwok made a new application for a judicial review, suggesting the legal amendment is unlawful as there's no mechanism for affected patients to appeal their invalidated exemption.

Kwok added that the law should not empower the health chief to void exemptions, as there's no guarantee that future health secretaries have the medical expertise to make the decision. 

This application was also handled by Coleman, who noted in a written judgment on Thursday that doctors who had their certificates invalidated can challenge the decision by way of written representations, and the government has offered clinical assessment for affected patients to determine whether he or she is unsuitable for vaccination.

The judge also said he doesn't think someone must be a doctor to have the power to invalidate exemption certificates, noting the secretary 'can, of course, be properly advised'. 

In his ruling, Coleman also said the government's decision to amend the law instead of appealing against his previous ruling was 'an example of the rule of law in action in Hong Kong'.";Radio Television Hong Kong
https://news.rthk.hk/rthk/en/component/k2/1674070-20221103.htm;2022-11-03 12:08:00; HK is the best financial centre in Asia: Paul Chan All Local Greater China World News Finance Sport;" HK is the best financial centre in Asia: Paul Chan Financial Secretary Paul Chan said on Thursday that the authorities have been monitoring local market volatility and have found no cause for alarm, as he touted Hong Kong as the best financial centre in Asia in a speech on the last day of the city's Global Financial Leaders' Investment Summit. 

Hong Kong's stock market is vibrant, active, highly liquid, efficient and transparent, attracting investors from all over the world, said Chan, who stressed that protecting investors is also important to officials. 

We set clear rules for our markets, stringent requirements on the participants, maintain high transparency of its functioning, ensuring that policies and practices are implemented in a consistent and predictable manner, he said.

The Hang Seng Index slid more than 300 points on Thursday morning following the US Federal Reserve's decision to lift its key interest rate by another 75 basis points. A week ago, the local benchmark lost more than 1,300 points. 

Chan acknowledged the market volatility, but said the authorities have been monitoring local market movements daily for any risks and irregularities and have found no cause for concern. 

Aside from its regulatory and monitoring regime, Chan pointed out that Hong Kong has also built strong buffers for turbulence and a war chest to defend its currency. 

He noted that the local banking system had assets of HK$3.3 trillion as of the end of last year, and that the Monetary Authority also holds around US$430 billion in foreign currency reserves. 

If you bet against the Hong Kong dollar, you are bound to lose, he warned. 

Chan said he hopes he has inspired more trust in Hong Kong's systems and markets. 

Hong Kong is an IFC (international financial centre) with an internationally aligned regulatory regime, deep liquidity, great transparency and much resilience, with proper safeguards to protect investors. We are simply the best IFC in Asia.";Radio Television Hong Kong
https://news.rthk.hk/rthk/en/component/k2/1674065-20221103.htm;2022-11-03 11:54:00; HK will bridge GBA and ASEAN countries: John Lee All Local Greater China World News Finance Sport;" HK will bridge GBA and ASEAN countries: John Lee Chief Executive John Lee on Thursday announced that Hong Kong is 'onstage again' and is ready to help build closer ties between other cities in the Greater Bay Area (GBA) and ASEAN cities. 

Lee was speaking at the Hong Kong ASEAN summit, where he noted that leading investors all over the world are converging in Hong Kong for two major financial events – the FinTech week and the Global Financial Leaders Investment Summit – and this shows Hong Kong and its financial system remain 'strong, sure and enviably secure'. 

'We have been living in the eye of a pandemic for nearly three years now. And we know first hand the extraordinary turbulence and the unprecedented chaos it has created for economies, businesses and communities all over the world, Hong Kong included,' he said. 

'It may take a crystal ball to tell whether we are now living and working in a new normal or simply working to revitalise the old normal. But what I can tell you loud and clear is that Hong Kong is onstage again, we have our doors open.'

Lee said Hong Kong's judicial system, free trade, and its location within the Greater Bay will help it facilitate the connection between ASEAN countries and the GBA. 

'Hong Kong remains the ASEAN community's critical partner in realising the far reaching opportunities offered by the fast growing GBA and its combined GDP of nearly US$2 trillion,' he said.

Lee said Hong Kong's good supply of talent is also helping it come back onstage, and he said the government's keen to bring in more professionals and companies to meet Hong Kong's strategic needs.";Radio Television Hong Kong
https://news.rthk.hk/rthk/en/component/k2/1674060-20221103.htm;2022-11-03 11:43:00; Number 8 storm signal rare in November: meteorologist All Local Greater China World News Finance Sport;" Number 8 storm signal rare in November: meteorologist The Meteorological Society says it is rare for Hong Kong to have a No 8 typhoon signal in autumn, with Wednesday's warning the first in November for 50 years.

Storm Nalgae earlier killed more than 100 people in the Philippines. But it was a more lacklustre affair in Hong Kong, with few reports of damage and no known casualties.

The society's Leung Wing mo said an anti cyclone weather system occurs around this time of the year in East Asia, producing northerly winds that normally push away approaching storms from the south.

He said an anti cyclone also explained why Nalgae moved slowly.

'Basically, you can imagine the movement of a tropical cyclone to be geared, or guided by an even larger weather system, and that is what we call a steering current, Leung said.

'Now the steering current is not pushing the tropical cyclone towards Hong Kong, therefore it's moving very slowly, because on its own there's no influence at all, because a tropical cyclone would normally move slowly northwards.'

Leung said moisture and rainfall are key factors when it comes to the intensity of tropical cyclones and a cold and dry environment in Hong Kong caused Nalgae to weaken.";Radio Television Hong Kong
https://news.rthk.hk/rthk/en/component/k2/1674008-20221103.htm;2022-11-03 05:31:00; Storm signals dropped as Nalgae moves away from HK All Local Greater China World News Finance Sport;" Forecasters warn that there are still occasional strong winds offshore and on high ground. Image courtesy of the Hong Kong Observatory The Observatory cancelled the Strong Wind Signal No. 3 an hour after issuing it at 5.20am on Thursday, as Nalgae moved away from Hong Kong.

It said Nalgae had weakened into a tropical depression and made landfall over Zhuhai.

At 6am, Nalgae was centred about 60 kilometres west of the Observatory and was forecast to move northwest at about 10 kilometres per hour across the western part of Guangdong.

Forecasters warn that there are still occasional strong winds offshore and on high ground. 

The Education Bureau said classes at AM and whole day kindergartens, as well as schools for children with disabilities, would be suspended on Thursday. 

Meanwhile, classes in primary and secondary schools, and in PM kindergartens, will resume.

Transport services such as the MTR, buses and ferries are also resuming normal operations.

All court and tribunal hearings will be resumed.
__________
Last updated: 2022 11 03 07.10 HKT";Radio Television Hong Kong
https://news.rthk.hk/rthk/en/component/k2/1673997-20221103.htm;2022-11-03 04:19:00; T8 to be downgraded by 5:20am All Local Greater China World News Finance Sport;" The Observatory said the T3 signal will be issued as tropical storm Nalgae moves away from Hong Kong and weakens. Image courtesy of the Hong Kong Observatory The Observatory has said it will downgrade the T8 signal at or before 5.20am on Thursday as tropical storm Nalgae moves away from Hong Kong and weakens.

The Observatory said the T3 signal would be issued as the storm was forecast to skirt the southern waters of Hong Kong as it heads towards the vicinity of the Pearl River Estuary.

At 4am, Nalgae was centred about 50 kilometres west southwest of the Observatory, and was expected to move northwest at about 10 kilometres per hour.

Forecasters warned that gale force winds are still affecting southwestern parts of the territory, and said seas remain very rough. 

The T8 signal, issued at 1.40pm on Wednesday, was the first one issued in November since 1972.

School classes, as well as most bus and ferry services, were suspended.

The government received 11 reports of fallen trees during the storm. There were no reports of landslides or flooding.

A woman injured during the typhoon is reported to have received treatment at the Accident and Emergency Department of a public hospital.";Radio Television Hong Kong
