URL;datetime;heading;text;newssite
https://hongkongfp.com/2022/11/05/lets-talk-about-sex-artist-claudia-chanhoi-on-genitals-shame-and-social-media-censorship/;2022-11-05 10:00:00+08:00; Let's talk about sex: Artist Claudia Chanhoi on genitals, shame and social media censorship; Hong Kong Free Press HKFP Hong Kong news – Independent, impartial, non profit Claudia Chanhoi is used to being censored. After all, she makes Instagram unfriendly art. Her social media pages are peppered with breasts, bums, penises and vaginas, sometimes euphemistically presented, sometimes explicitly so, but always in a highly stylised aesthetic that favours bold colours and bolder lines. Suggestive subject matter is a Chanhoi signature, regardless of whether she is delving into the disposable nature of contemporary dating or discussing whether we can disassociate body parts from sexual content, and it frequently brings her into censors' line of fire. 'My work used to be censored and taken down from social media a lot because I often feature genitals in my art,' Chanhoi told HKFP. 'Even though I feel it's far from explicit  my work still got censored,' she continued, adding that it left her feeling 'confused' and 'a little bit attacked as a creative.' 'Why is my art shameful or offensive to others, while we see sexualised images of women pretty much everywhere?' Rather than bend to the puritanical will of Behance, Facebook and Instagram, Chanhoi doubled down. 'This is why I have been constantly doing lots of work with genitals or work about sexualisation, because to me, it was a bit like a protest,' she said. Her frank approach to sex and sexual organs is also rooted in rebellion. 'I grew up in a very conservative environment, because I was born Catholic and I also went to Catholic school,' Chanhoi said. 'I feel like the fact that I am so interested in talking about [sexuality] is just because I couldn't.' Born in Hong Kong, Chanhoi's career as an artist took off while she was at art school in Britain. 'Everything came from my university projects,' she said, which were largely focused on the sexual objectification of women. At the same time, she was learning about her area of study outside of the institution. 'I feel like I was constantly seen as a foreign object in the UK,' she said, adding that she has always felt safer in Hong Kong. 'People would cat call me and I would get a lot of comments on the way I look  and also being an Asian woman was  I wouldn't say a scary thing but I always felt like it was quite a dangerous body to be in.' London, Chanhoi said, has progressed since then. Her conservative hometown, however, has not. 'I feel like the world has changed a lot  in Hong Kong, we are still, let's say, 10 years behind.' Chanhoi has worked with Swedish sex toy brand Lelo, which surveyed Hongkongers' attitudes to sex and extras in 2021 and found that 52 per cent of respondents were not open to using sex toys, saying they believed them to be perverted or were afraid of how their partner may react. Despite believing Hong Kong to be buttoned up, Chanhoi said she was 'still quite surprised' to discover how many people held that opinion. 'In 2022  we see sexualised images all the time but when it comes to exploring our sexuality we're just so, I don't know, scared of it or ashamed of it,' Chanhoi said. 'Like it's taboo to talk about it – which it shouldn't be – because we see 'sex sells' everywhere. I just don't understand where that perspective comes from.' 'We're not supposed to be born with shame.' Chanhoi said she believed it was learned behaviour, perhaps from being told not to talk about our genitals as children or being encouraged to address sexual organs by alternative names. 'But then you begin to learn that there's something wrong with them, they must be something bad,' she said. 'This is how we learn that  some of our body parts can be shameful.' Chanhoi explores and subverts this sense of shame in her work, which puts genitals front and centre, always in a playful way. In one diptych pinned to the top of her Instagram page, a cartoonish clitoris appears alongside a pair of testes, a pubic area complete with pubic hair, an Adam's apple and hairy legs. In the caption, she asks: 'Can we start (de)sexualising [body parts] and look at them without shame and disgust?' Although allowed to remain on Instagram, the images were recently removed from Adobe's portfolio style platform Behance. 'They just said something like, nudity is not allowed,' Chanhoi said, her detached tone revealing how familiar she is with this response. 'You know, obviously  But there's no nudity. This is what my art is all about, right, playing around with [that] idea.' 'I am used to being censored so I like to add a little something to see if that will be censored.' On a more serious note, though, Chanhoi said she believed something was amiss in the way we see – or rather do not see – our sexual organs portrayed in the media. 'We can't really separate sexualisation and body parts. Because we associate them with something like porn, but it is not always like that,' she said. 'Lots of Instagrammers post pictures of them being super sexy and super sexualised, but once a genital is featured, it becomes like, 'oh my god, that's so unacceptable we should take it down or remove it',' Chanhoi continued. 'It's just really interesting that one tiny little genital could change so much when we pretty much see soft porn everywhere in the media, or TV shows.' After four years overseas, Chanhoi returned to Hong Kong – a city which, at least at first, was slow to catch on to her provocative style. 'I felt, at the time, people would not be happy with my work, especially in a place like Hong Kong,' she said. But 'that completely changed because of Apple Daily,' she said. In 2019, the pro democracy tabloid – which has since been forced to shutter after top executives were arrested under Hong Kong's national security law and its newsroom was raided by police – interviewed her. That interview 'changed the game completely,' Chanhoi said. 'Their audience was huge, crazily huge. I mean, to be honest, I was not really an Apple Daily reader, but it was so sad to see it shut down like that.' Overnight, Chanhoi said she started being approached by Hong Kong based clients, and found herself with new, Hong Kong based followers. Chanhoi left her job as a brand design manager earlier this year to dedicate herself to her art full time. Still, she said, she often hears that her work is 'a bit too much' or brands will ask her to 'not include the genitals,' while saying 'we still want you to draw something about sexuality.' Most often, the clients expressing such hesitations were those in Hong Kong, Chanhoi said, adding that most of her commissions came from overseas. 'It's just a little bit more conservative here when it comes to sexuality and body parts.' 'In Hong Kong, being an artist can be quite difficult,' she said, adding that she did not see Beijing's plan to position the city as a cultural hub helping emerging artists such as herself. 'Not personally and not professionally,' she answered when asked whether the opening of M+ and other planned museums might have a trickle down effect on the local art ecosystem. Regardless, Chanhoi is keeping busy. She will be speaking on genitals and taboos at the TEDxTinHauWomen event next month and has recently completed a 'really fun' project for a UK based client on the theme of sex and Christmas. 'Cute, sexy illustrations  like a reindeer with a gag,' she said. Support HKFP    Code of Ethics    Error/typo?    Contact Us  Newsletter   Transparency & Annual Report Support press freedom & help us surpass 1,000 monthly Patrons: 100% independent, governed by an ethics code & not for profit, Hong Kong Free Press is #PressingOn with impartial, award winning, frontline coverage. Support HKFP    Code of Ethics    Error/typo?    Contact Us  Newsletter    Annual & Transparency Report Mercedes is a Hong Kong based British journalist with an interest in environmental and social issues. She has written for the Guardian and the BBC and previously worked at the South China Morning Post. Loading... Something went wrong. Please refresh the page and/or try again. Loading... Something went wrong. Please refresh the page and/or try again. Views expressed by opinion writers and advertisers are not necessarily shared by HKFP.;Hong Kong Free Press
https://hongkongfp.com/2022/11/02/covid-19-hong-kong-october-arrivals-down-97-compared-to-pre-pandemic-2019-data/;2022-11-02 09:00:00+08:00; Covid 19: Hong Kong October arrivals down 97% compared to pre pandemic 2019 data; Hong Kong Free Press HKFP Hong Kong news – Independent, impartial, non profit Hong Kong saw 97.7 per cent fewer arrivals in October than in October 2019, despite recent relaxations to Covid 19 quarantine rules for inbound travellers. According to Immigration Department statistics, Hong Kong saw 10.8 million arrivals in October 2019, but only 318,935 last month. On Tuesday, Hong Kong's John Lee said the city was 'full of life' since the hotel quarantine requirement was axed, adding that overall arrival numbers rose 1.6 times in October compared to September. Since September 26, arrivals no longer need to quarantine in a designated hotel. Instead, they undergo almost a dozen Covid 19 tests and three days of 'medical surveillance,' during which they can leave home but will be restricted from entering premises such as bars and restaurants. Hong Kong still enforces a group gathering limit of 12 in public, makes mask wearing compulsory, and requires tracing apps for entering certain premises such as restaurants. The city is hosting a FinTech event, a bankers' summit and the Hong Kong Rugby Sevens this week, as it seeks to demonstrate it is reopen for business. Since the onset of the pandemic, Hong Kong has seen 10,397 deaths and 1.91 million cases according to the government's Covid 19 dashboard on Tuesday. Support HKFP    Code of Ethics    Error/typo?    Contact Us  Newsletter   Transparency & Annual Report Support HKFP    Code of Ethics    Error/typo?    Contact Us  Newsletter    Annual & Transparency Report Tom is the editor in chief and founder of Hong Kong Free Press. He has a BA in Communications and New Media from Leeds University and an MA in Journalism from the University of Hong Kong. He has contributed to the BBC, Euronews, Al Jazeera and others. Loading... Something went wrong. Please refresh the page and/or try again. Loading... Something went wrong. Please refresh the page and/or try again. Views expressed by opinion writers and advertisers are not necessarily shared by HKFP.;Hong Kong Free Press
https://hongkongfp.com/2022/10/31/exclusive-university-of-hong-kong-makes-library-users-register-to-access-some-politically-sensitive-books/;2022-10-31 19:40:00+08:00; Exclusive: University of Hong Kong makes library users register to access some politically sensitive books;" Hong Kong Free Press HKFP Hong Kong news – Independent, impartial, non profit The library at Hong Kong's top university has introduced a new system under which readers must register in advance to gain access to some politically sensitive books or archive materials. A Hong Kong researcher said the new policy, which follows moves by the city's public libraries to remove some titles, might impede study of more 'sensitive' topics. The new system has been installed at the University of Hong Kong's (HKU) Special Collections, a space separated by a glass wall within the Main Library building. The area 'houses a unique collection of Hong Kong materials, rare books, and microforms,' according to HKU's website. The Special Collections section was closed from mid February till April for what the university described last December as being for 'Air Handling Unit and dehumidifier replacement.' The statement last December did not mention any changes to accessibility after the space reopened. On May 18, HKU announced a new booking system for reserving desks in the Special Collections area 'to enhance the user experience.' Patrons were required to register books which they wished to consult at the counter. Anyone who wishes to take a photo with their smartphone of a book must first fill out a form, specifying the details of the book and the number of photos to be taken. Previously, users of the Special Collections section did not have to make bookings in advance or register books they wished to consult. The university told HKFP the new booking arrangements were made 'to effectively protect and preserve the fragile and irreplaceable materials for future generations of scholars.' When HKFP visited the library last month, five politically sensitive books – either written by activists or dealing with the 1989 Tiananmen crackdown – were available only in the Special Collections section. The five titles included the English version of Joshua Wong's Unfree Speech: The Threat to Global Democracy and Why We Must Act, Now; Nathan Law's Freedom: How We Lose It and How We Fight Back; Chin Wan's On the Hong Kong City state; Mark Clifford's Today Hong Kong, Tomorrow the World: What China's Crackdown Reveals About Its Plan to End Freedom Everywhere, and a photobook by the now disbanded Hong Kong Alliance in Support of Patriotic Democratic Movements of China. For three other books on the Tiananmen crackdown, including the Factual Account of a Search for the June 4 Victims by the leader of the Tiananmen Mothers Ding Zilin, readers had to request access online. Separately, the city's public libraries removed 29 out of 149 books about the Tiananmen crackdown from their shelves, a total of 263 individual copies, an HKFP investigation found last year. The university did not answer questions on how the library determines what books are to be made accessible only on request. In addition to contemporary political books, the Special Collections also hosts colonial records including government gazettes, and Hansards, with some of the materials digitalised by HKU and made available online to the public. A Hong Kong policy researcher, who requested anonymity, told HKFP the new arrangements may deter some from conducting research on more 'sensitive topics.' 'The library still records who borrowed what, and when, they even collect what copies the researchers made. The perception of being 'monitored' is still there, and it may deter researchers from pursuing certain sensitive topics,' the researcher said. While some books might still be on the shelves, 'researchers may have second thoughts on borrowing them.' The researcher described the new policy as 'disproportionate' since it covers the entire Special Collections, including non sensitive materials. 'It is definitely an unnecessary hindrance to the research community.' Apart from public libraries, some primary and secondary school libraries have removed books on topics ranging from introductions to the city's electoral system, to historical titles about the Cultural Revolution, Ming Pao reported. The Education Bureau in February last year published guidelines requiring schools to ensure that materials do not endanger national security. While HKU, like the seven other publicly funded universities in the city, has launched a compulsory national security course, books that are politically sensitive or censored in mainland China such as The People's Republic of Amnesia: Tiananmen Revisited by Louisa Lim, The Tiananmen Papers by Liang Zhang and a memoir by Ai Wei Wei, are still freely available in the university's main library, The Beijing imposed national security law, enacted in June 2020, criminalises subversion, secession, collusion with foreign forces and terrorist acts, which were broadly defined to include disruption to transport and other infrastructure. The move gave police sweeping new powers, alarming democrats, civil society groups and trade partners, as such laws have been used broadly to silence and punish dissidents in China. However, the authorities say it has restored stability and peace to the city. Clarification 31.10.2022: A previous version of this article refers to the English version of Joshua Wong's Unfree Speech: the threat to global democracy and why we must act, now, being only available at the Special Collections section. The Chinese version of the book is also available at Fung Ping Shan Library. Support HKFP    Code of Ethics    Error/typo?    Contact Us  Newsletter   Transparency & Annual Report Support HKFP    Code of Ethics    Error/typo?    Contact Us  Newsletter   Transparency & Annual Report Support HKFP    Code of Ethics    Error/typo?    Contact Us  Newsletter    Annual & Transparency Report Loading... Something went wrong. Please refresh the page and/or try again. Loading... Something went wrong. Please refresh the page and/or try again. Views expressed by opinion writers and advertisers are not necessarily shared by HKFP.";Hong Kong Free Press
https://www.hongkongfp.com/2020/03/19/editorial-hkfp-gets-full-marks-newsguard-initiative-meeting-9-credibility-transparency-criteria/;2020-03-19 20:00:00+08:00; Editorial: HKFP gets full marks from NewsGuard initiative for meeting all 9 of its credibility and transparency criteria; Hong Kong Free Press HKFP Hong Kong news – Independent, impartial, non profit Hong Kong Free Press has met all nine of the NewsGuard initiative's credibility and transparency criteria, a week after we launched our Code of Ethics and just ahead of our website relaunch. NewsGuard lists green or red credibility scores for over 4,000 news websites, representing 95 per cent of all online news engagement. The assessments – carried out by humans, not algorithms, appear next to links across search engines and social media after the NewsGuard plugin is installed. The initiative is run by journalists and is part of a global fightback against misinformation, unreliable content and fake news. Their assessment for HKFP was completed on Wednesday. 'Misinformation on social media and state backed propaganda became rife during the recent protests in Hong Kong, and media credibility is ever more critical with this year's coronavirus outbreak,' said HKFP Editor in Chief Tom Grundy. 'Whilst readers need to navigate what sources of information are credible, media outlets must also demonstrate their independence and be open about how they operate, who's in charge and how they're funded. In the past week, we have published a comprehensive ethical code and corrections policy as part of our leading commitment to transparency, and ahead of our April website relaunch.'  NewsGuard cited evidence of HKFP meeting its nine criteria: Trust ratings for 4,000+ news sites. Written by journalists, not algorithms. Transparent, accountable, and right in your browser. Try NewsGuard for free: https://t.co/wmWvm5ssB2 pic.twitter.com/cXcgn2EGUk — NewsGuard (@NewsGuardRating) February 10, 2020 The final phase of HKFP's relaunch involves a complete website redesign and overhaul as part of the Newspack initiative – we aim to complete the website migration in early April following a brief shutdown. Not for profit, run by journalists and completely independent, the HKFP team relies on readers to keep us going and to help safeguard press freedom. Learn more about our achievements in our latest Annual Report. Our Transparency Report shows how carefully we spend every cent. Support HKFP    Code of Ethics    Error/typo?    Contact Us  Newsletter    Annual & Transparency Report Hong Kong Free Press is a new, non profit, English language news source seeking to unite critical voices on local and national affairs. Free of charge and completely independent, HKFP arrives amid rising concerns over declining press freedom in Hong Kong and during an important time in the city's constitutional development. Loading... Something went wrong. Please refresh the page and/or try again. Loading... Something went wrong. Please refresh the page and/or try again. Views expressed by opinion writers and advertisers are not necessarily shared by HKFP.;Hong Kong Free Press
https://hongkongfp.com/2022/11/08/event-hong-kongs-clockenflap-festival-returns-in-march-2023-after-covid-hiatus/;2022-11-08 17:34:00+08:00; Event: Hong Kong's Clockenflap festival returns in March 2023 after Covid hiatus; Hong Kong Free Press HKFP Hong Kong news – Independent, impartial, non profit Hong Kong's premier music festival, Clockenflap, is to return next March to Central Harbourfront after a three year hiatus. Organisers say it is '100 per cent confirmed' for Friday March 3 until Sunday March 5, 2023. A full festival experience, with multiple outdoor stages and F&B outlets are in the works, alongside a diverse line up of international, regional and local acts. The 12th edition of Clockenflap comes after it was was cancelled in 2020 and 2021 owing to the Covid 19 pandemic, and was axed in 2019 due to the pro democracy protests and unrest. Clockenflap is back! 3 5 Mar 23 at Central Harbourfront, as we return with our full festival experience: Local & International talent, outdoor location, multiple stages, free standing,F&B & muchos fun.Stay tuned for our first lineup ann. & ticket details https://t.co/jrCEWItaTL pic.twitter.com/njopR0oRdD 'The first line up announcement and early bird ticket details will be announced soon. Unrefunded tickets purchased for Clockenflap 2021 remain valid for the new dates, and the arrangements for using these tickets will be shared with existing ticket holders closer to the festival,' organisers said. Support HKFP    Code of Ethics    Error/typo?    Contact Us  Newsletter   Transparency & Annual Report Support press freedom & help us surpass 1,000 monthly Patrons: 100% independent, governed by an ethics code & not for profit, Hong Kong Free Press is #PressingOn with impartial, award winning, frontline coverage. Support HKFP    Code of Ethics    Error/typo?    Contact Us  Newsletter    Annual & Transparency Report Hong Kong Free Press is a new, non profit, English language news source seeking to unite critical voices on local and national affairs. Free of charge and completely independent, HKFP arrives amid rising concerns over declining press freedom in Hong Kong and during an important time in the city's constitutional development. Loading... Something went wrong. Please refresh the page and/or try again. Loading... Something went wrong. Please refresh the page and/or try again. Views expressed by opinion writers and advertisers are not necessarily shared by HKFP.;Hong Kong Free Press
