URL;datetime;heading;text;newssite
https://www.scmp.com/news/hong-kong/society/article/3198896/operation-santa-claus-hong-kong-charity-teaching-special-needs-children-communicate-gets-helping;2022-11-10 02:00:00+00:00; Operation Santa Claus: Hong Kong charity teaching special needs children to communicate gets helping hand; Organisation aims to popularise sign language, promotes sign bilingualism – the use of both signed and spoken language – and encourages inclusiveness Charity's Operation Santa Claus project will enable children with special needs aged 18 or below to learn sign language;South China Morning Post
https://www.scmp.com/news/hong-kong/society/article/3198955/hong-kong-worksite-deaths-harsher-penalties-employers-and-contractors-debated-over-alarming-trend;2022-11-10 01:00:00+00:00; Hong Kong worksite deaths: harsher penalties for employers and contractors debated over alarming trend that 'tears apart families'; Unionists want the law changed soon, but construction sector bosses feel targeted unfairly Construction sector fares worst in grim statistics of workplace accidents causing injury, death;South China Morning Post
https://www.scmp.com/news/hong-kong/health-environment/article/3199054/healthcare-start-ups-eye-potential-investors-hong-kongs-global-health-summit;2022-11-09 23:00:00+00:00; Healthcare start ups eye potential investors at Hong Kong's global health summit; About 180 local and overseas healthcare start ups to showcase innovations at Asia Summit on Global Health Chief Executive John Lee and World Health Organization deputy director general Zsuzsanna Jakab among speakers at summit;South China Morning Post
https://www.scmp.com/news/hong-kong/society/article/3199059/im-it-win-it-hong-kongs-florists-optimistic-about-business-ahead-lunar-new-year-fair;2022-11-09 15:58:00+00:00; 'I'm in it to win it': Hong Kongs florists optimistic about business ahead of Lunar New Year fair; Bidding for 175 wet goods stalls begins, with three by four metre stall attracting highest bid of HK$56,000 Event, which was suspended this year, will be held from January 16 to 22 next year at 15 locations, including Victoria Park;South China Morning Post
https://www.scmp.com/news/hong-kong/hong-kong-economy/article/3199058/hong-kong-signs-deal-increase-investment-zhuhai-airport-bid-benefit-air-industry-both-cities;2022-11-09 15:46:00+00:00; Hong Kong signs deal to increase investment in Zhuhai airport in bid to benefit air industry in both cities; Hong Kong to invest more in Zhuhai airport and create aviation industrial park in Greater Bay Area city Aviation experts say the deal will boost both airports and solidify Hong Kong's position as a regional hub for international flights;South China Morning Post
https://www.scmp.com/news/hong-kong/law-and-crime/article/3199048/hong-kong-police-anti-scam-site-saves-public-least-hk400-million-fraud-losses-september-launch;2022-11-09 13:08:00+00:00; Hong Kong police anti scam site saves public at least HK$400 million in fraud losses since September launch, police say;" Police say 4,350 red flags raised among 74,000 inquiries in October alone; 7,450 rated at lower risk level Junk phone number database boss warns of increase in scam calls from city, rather than overseas";South China Morning Post
https://www.scmp.com/cdn-cgi/l/email-protection#5f333a2b2b3a2d2c1f2c3c322f713c3032;; Email Protection;" The website from which you got to this page is protected by Cloudflare. Email addresses on that page have been hidden in order to keep them from being accessed by malicious bots. You must enable Javascript in your browser in order to decode the e mail address. If you have a website and are interested in protecting it in a similar way, you can sign up for Cloudflare. Cloudflare Ray ID: 767b342d4f0ab10f
•

Your IP:
Click to reveal
34.73.6.137
•

Performance & security by Cloudflare";South China Morning Post
https://www.scmp.com/news/hong-kong/health-environment/article/3197357/hong-kong-covid-19-vaccination-exemptions-row-how-did-we-get-here-and-where-will-it-end;2022-10-26 14:03:00+00:00; Hong Kong Covid 19 vaccination exemptions row: how did we get here and where will it end?; Health chief's move to annul more than 20,000 vaccination exemptions has become a legal row Government's amendment to law may not be end of issue as former civil servant plans wider review;South China Morning Post
https://www.scmp.com/news/hong-kong/health-environment/article/3193651/coronavirus-hong-kong-finally-axing-hotel;2022-09-23 15:19:00+00:00; Coronavirus: Hong Kong is finally axing hotel quarantine for arrivals – here's what you need to know; Travellers will no longer be confined to hotel rooms for quarantine upon arrival in Hong Kong from Monday Unvaccinated residents are also allowed to enter the city;South China Morning Post
https://www.scmp.com/news/hong-kong/hong-kong-economy/article/3192084/hong-kong-has-extended-its-covid-19-vaccine-pass;2022-09-11 03:00:00+00:00; Hong Kong has extended its Covid 19 vaccine pass to children as young as 5. Here's what parents need to know; New scheme comes into force on Friday with first phase requiring younger residents to get at least one vaccine dose Range of criteria for those who have recovered from Covid 19, depending on their vaccination status and time since last jab;South China Morning Post
https://www.scmp.com/news/hong-kong/health-environment/article/3188205/hong-kong-easing-its-hotel-quarantine-rules;2022-08-09 01:01:00+00:00; Hong Kong is easing its hotel quarantine rules for overseas arrivals: here's what you need to know; Quarantine period in lockdown hotel to be cut as Hong Kong relaxes anti coronavirus measures from Friday People to stay in hotel quarantine for three days instead of seven, but restricted movement for four more days if tests are clear;South China Morning Post
https://www.scmp.com/comment/opinion/article/3198742/seven-lessons-sevens-rugby-success-hong-kong-reopens-events;2022-11-09 00:15:00+00:00; 7 lessons from Sevens rugby success as Hong Kong reopens for events; From reviewing Covid 19 rules to the needs of the events industry, Hong Kong has a chance to reposition itself as an events capital – with the catalyst of the success of the Hong Kong Sevens;South China Morning Post
https://www.scmp.com/comment/opinion/article/3198408/if-bankers-can-get-special-00-travel-treatment-let-rest-hong-kong-too;2022-11-07 00:15:00+00:00; If bankers can get the special '0+0' travel treatment amid Covid pandemic, let the rest of Hong Kong too; The overseas executives attending Hong Kong's financial summit enjoyed a mostly Covid rule free visit as John Lee declared the city back in business Good for them, but residents are still anxiously waiting to be given the same green light;South China Morning Post
https://www.scmp.com/comment/opinion/article/3198336/super-connector-hong-kong-its-all-about-economy-so-covid-19-rules-have-go;2022-11-06 05:30:00+00:00; For 'super connector' Hong Kong, it's all about the economy – so Covid 19 rules have to go; All the government plans to revive Hong Kong need money. And only a growing economy will generate the revenues needed That means we have to open up to the world quickly and drop all Covid related restrictions, in testing, checking and masking;South China Morning Post
https://www.scmp.com/comment/opinion/article/3197916/be-arts-and-cultural-centre-hong-kong-must-first-make-clear-censorship-red-lines;2022-11-05 22:30:00+00:00; To be an arts and cultural centre, Hong Kong must first make clear censorship 'red lines'; The increasingly random nature of the works being banned out of national security law considerations hurts Hong Kong's reputation as an open society Considering the creative exodus and distrust of the security law, there is urgent need for government reassurance through words and deeds;South China Morning Post
https://www.scmp.com/comment/opinion/article/3198144/global-race-talent-heres-how-hong-kong-can-get-ahead;2022-11-04 00:15:00+00:00; In the global race for talent, here's how Hong Kong can get ahead; Hong Kong isn't alone in facing a shortage of future proof talent, which means it needs to be extra competitive The necessary steps – reform education, reskill workers, improve quality of life, retain talent – are well known, but require collective effort;South China Morning Post
https://www.scmp.com/comment/opinion/hong-kong/article/3197590/struggling-hongkongers-need-more-flashy-strive-and-rise-scheme-escape-poverty;2022-10-30 22:45:00+00:00; Struggling Hongkongers need more than flashy 'Strive and Rise' scheme to escape poverty; The high profile scheme unveiled by the government will do little to inspire hope among the needy and spur the fight against intergenerational poverty Instead, there must be real political will and leadership that addresses poverty's underlying causes and the structural odds stacked against the poor;South China Morning Post
https://news.rthk.hk/rthk/en/component/k2/1674879-20221109.htm;2022-11-09 19:06:00; 'Govt departments should set carbon emission targets' All Local Greater China World News Finance Sport;" Greenpeace campaigner Tom Ng says some government carbon reduction targets are outdated. Photo: RTHK A green group on Wednesday called on government departments to set their own carbon emission targets and lay out a more comprehensive roadmap to carbon neutrality.

In its latest study, Greenpeace spoke to 74 departments in September about their carbon emission efforts, and examined Environmental Performance Reports released in 2021 by 44 of them.

While the government's target is for Hong Kong to achieve carbon neutrality before 2050, the study found that none of its departments had set quantifiable emission targets or a timetable for carbon neutrality.

'Actually there are so many measures they can do. I would say that after how many years of promoting carbon neutrality, they know how to do it, said Greenpeace campaigner Tom Ng.

'They know what kind of measures are needed, but they also need to show the public what are their goals, and when are they going to achieve those goals.'

Ng also called some carbon reduction policies covered in the government reports 'out of date', saying some of them have been in place for almost a decade.

He said that for example in one of the latest reports, using lead free petrol was mentioned as an environmental initiative, despite leaded petrol being banned since 1999. 

Ng urged the government to roll out up to date environmental policies to realise its carbon neutral goal by 2050.

RTHK has reached out to the Environment and Ecology Bureau for a response.";Radio Television Hong Kong
https://news.rthk.hk/rthk/en/component/k2/1674873-20221109.htm;2022-11-09 17:22:00; Court allows UK lawyer to represent Jimmy Lai All Local Greater China World News Finance Sport;" Jimmy Lai will go on trial on December 1. File photo: AFP An appellate court on Wednesday upheld a decision to allow a veteran British lawyer to defend media tycoon Jimmy Lai in his upcoming national security trial. 

Lai, 74, had earlier been granted permission by High Court Judge Jeremy Poon to engage King's Counsel, Timothy Owen, in the trial that is scheduled to begin on December 1. 

The Secretary for Justice subsequently appealed against the admission of Owen, arguing that his involvement will not add any significant dimension to the trial. 

The government had argued that Owen did not have the expertise or experience in issues concerning the offences that Lai was charged with under the national security law – which it said was tailored to Hong Kong's unique constitutional framework. 

As for another charge of printing and distributing seditious publications brought against Lai under the Crimes Ordinance, the government said there is already 'substantial experience' among local barristers to handle it. 

But a three judge panel rejected the government's grounds. 

In a written judgment, the panel said the decision to admit Owen had balanced different aspects, including the novelty and the great general public importance of the legal issues involved, the unusual difficulty and complexity of the case, and its substantial impact on the development of Hong Kong law. 

The appellant court said 'the unique context of the national security law' should not take precedence over other aspects of public interest when it comes to the admission of overseas counsels. 

The judges added that the public's perception of fairness in the trial is of vital importance to the administration of justice, adding that Owen should be admitted on grounds of public perception as well. 

Lai, the founder of the now defunct Apple Daily newspaper, will face trial for allegedly taking part in a conspiracy to print, publish, sell, offer for sale, distribute, display and/or reproduce seditious publications, as well as conspiring with others to collude with a foreign country or external elements to endanger national security.";Radio Television Hong Kong
https://news.rthk.hk/rthk/en/component/k2/1674881-20221109.htm;2022-11-09 17:09:00; Hong Kong logs 5,068 new Covid cases All Local Greater China World News Finance Sport;" Officials say 13 more Covid patients have died. Image: Shutterstock Health officials on Wednesday logged 5,068 new Covid infections, including 498 imported cases.

The tally was up from 4,649 reported the day before.

13 patients with Covid have died, including a 31 month old boy. 
_____________________________

USEFUL LINKS
General Covid 19 situation: https://www.coronavirus.gov.hk/eng/
Community Clinics for Covid 19 patients: https://bit.ly/3EiiczC
RAT reporting platform: https://www.chp.gov.hk/ratp/
Vaccination programme: https://www.covidvaccine.gov.hk/sen/
Vaccination pass scheme:https://www.coronavirus.gov.hk/eng/vaccine pass.html 
Hotline for Covid positive patients: 1836 115";Radio Television Hong Kong
https://news.rthk.hk/rthk/en/component/k2/1674864-20221109.htm;2022-11-09 16:31:00; Teacher arrested for making false abuse claims All Local Greater China World News Finance Sport;" Police say a 48 year old teacher was arrested in the case. Police said they've arrested a teacher at a special needs school in Tai Po on Monday for allegedly falsely accusing her colleagues of abusing students. 

The force said the 48 year old teacher of Hong Chi Pinehill No.2 School is suspected to have sent anonymous letters to parents, the school's managing body as well as the Education Bureau, falsely claiming that a number of teachers had abused students.

Chief Inspector Mo Siu hei said upon receiving reports in August, officers conducted a thorough probe into the matter and found the allegations to be exaggerated and false. 

Mo added that some of the video clips that came with the letters were recorded four to eight years ago. 

'After investigating [the case], it was found that some of the accused staff in the clip was not present at the time,' he said.

He pointed out that officers had gone through all surveillance camera footage at the school between June and August this year, but found nothing suspicious. 

'The letter is aimed at the school management and specific staff. We do not rule out that someone was dissatisfied with the work arrangements, and then made anonymous letters accusing colleagues and senior staff of child abuse, he said.

The 48 year old was arrested in suspicion of accessing a computer with criminal or dishonest intent, and wasteful employment of the police.

Officers said they seized a computer and printer from her office, which they believed were used for making the anonymous letters.";Radio Television Hong Kong
https://news.rthk.hk/rthk/en/component/k2/1674866-20221109.htm;2022-11-09 16:22:00; KPIs show govt's commitment to deliver: John Lee All Local Greater China World News Finance Sport;" John Lee says the government will not work behind closed doors. Photo: RTHK Chief Executive John Lee says the key performance indicators proposed in his recent policy address show the government is committed to delivering results and will not work behind closed doors.

Speaking on RTHK's Overview Policy show to be aired on Wednesday evening, the CE said there are 110 such indicators after officials put forward their thoughts as they prepared the policy blueprint together.

We are not afraid of difficulties, we are not conservative. We want to let people know we hope to really deliver, and we are telling you what we want to deliver. We are committed, Lee said.

The indicators, covering areas like housing supply and social welfare, can help authorities improve their work, he added.

Lee also said that a planned Chief Executive's Policy Unit will serve a much different role from that of the Executive Council.

I would want to listen to the Executive Council's opinion before passing a law provision, but the Chief Executive's Policy Unit will be able to [touch upon] things with no boundaries.

For example, he said, the new policy unit should possess global perspectives and tell him what to pay attention to amid changing international circumstances.

Lee said the new unit and Exco will complement each other.";Radio Television Hong Kong
https://news.rthk.hk/rthk/en/component/k2/1674860-20221109.htm;2022-11-09 15:37:00; CUHK followed rules over aborted emblem change: govt All Local Greater China World News Finance Sport;" CUHK followed rules over aborted emblem change: govt Education Secretary Christine Choi on Wednesday said Chinese University clearly followed regulations when it recently attempted to change its emblem.

CUHK last month reverted back to the old emblem after a public backlash, with some lawmakers arguing that the saga was a case of poor governance. 

Responding to a question in the Legislative Council, Choi said the university formed a committee on the emblem in accordance with the law, adding that the government doesn't interfere in CUHK's internal decisions because of institutional autonomy.

So it's not the case that the committee made its own decisions. It had to report to the governing council via the vice chancellor, she told lawmakers, adding that people can take such matters to court if they suspect a breach of regulations.

Business and Professionals Alliance lawmaker Priscilla Leung accused Choi of dancing around the issue, alleging that the governing council had failed in its supervisory role regarding the emblem change.

Leung claimed that a low percentage of outsiders on CUHK's council has caused poor governance, citing government figures as saying that outsiders make up more than half of the members of several university councils in Hong Kong, but just 17 percent at CUHK.

Choi, however, stressed that the composition of the university councils is related to the different history and development of the institutions.

The minister said it's normal for stakeholders to have different views about university governance, but they should have frank exchanges with the university for the overall interests of all sides. 

Leung, who said she was not happy with Choi's answers, also complained that three lawmakers who are CUHK council members do not have the power to ensure an item is discussed by the governing body.

The existing [CUHK] ordinance has given too much discretion for a publicly funded university, and I believe it has provided a lot of loopholes for the CUHK management to disregard the opinion of the council, she told reporters.

The lawmaker said she plans to invite CUHK management to a Legco panel meeting next month to discuss the institution's governance.";Radio Television Hong Kong
https://news.rthk.hk/rthk/en/component/k2/1674813-20221109.htm;2022-11-09 11:49:00; Anti smoking campaigner calls for tobacco tax hike All Local Greater China World News Finance Sport;" Judith Mackay, director of the Asian Consultancy on Tobacco Control, says raising the tobacco tax and the price of cigarettes would discourage youngsters from smoking. Image: Shutterstock An anti tobacco advocate on Wednesday hailed the work of Hong Kong in bringing down the city's smoking rate over the past 40 years, but said more needs to be done to further deter people from lighting up. 

Dr Judith Mackay, director of the Asian Consultancy on Tobacco Control, told RTHK's Hong Kong Today programme that the city had performed remarkably well, passing a slew of legislation and raising the tobacco tax. 

But Mackay said the government needs to bring in further measures as there are still hundreds of thousands of smokers in the territory. 

She threw her support behind a proposal by the government to continuously raise the city's legal smoking age, saying studies show the average age to take up the habit is under 20, when youngsters' brains are still not fully developed. 

So if we can prevent people from starting smoking until they're 23 or 24, then they're most unlikely to start, Mackay said.

The expert added that raising the tobacco tax is also crucial in discouraging youngsters to smoke. 

They just simply can't afford expensive cigarettes. It's as simple as that. So it's not health education in schools, it's actually a fiscal measure that really helps them stop. And we haven't had a tax increase, inexplicably, we haven't had a tax increase since 2014, Mackay said. 

Health minister Lo Chung mau said on Tuesday that the government is considering completely banning future generations from buying tobacco products.

Lo said the city's smoking rate is currently at 9.5 percent – down from 23 percent in the early 1980s.";Radio Television Hong Kong
https://news.rthk.hk/rthk/en/component/k2/1674816-20221109.htm;2022-11-09 11:37:00; Not enough kids are vaccinated against Covid: govt All Local Greater China World News Finance Sport;" Not enough kids are vaccinated against Covid: govt The Secretary for the Civil Service, Ingrid Yeung, on Wednesday renewed her call for parents to get their children vaccinated against Covid 19, saying not enough have done so.

On an RTHK programme, Yeung noted that children as young as six months can now receive a diluted version of the BioNTech vaccine, as an alternative to the Sinovac jab that was already available.

As at 7pm on Tuesday, 750 bookings were made for the toddler formula of the BioNTech vaccine. She said the number of bookings for child jabs has not been satisfactory.

'The vaccination rate for children aged below three is lower than 19 percent. It is very worrying. In particular for parents who plan to take their children on holiday during Christmas or the Lunar New Year, they should really have their kids vaccinated,' she said, adding that the government does not have a target as to how many young children it wants to see inoculated against the coronavirus.

The minister said while there's no walk in arrangement for the BioNTech toddler jabs, she believes parents can easily make a booking for the same day as there are still many free slots at the moment. 

On the same programme, the chairwoman of the Subsidised Primary School Council, Vu Im fan, said primary schools are making preparations to resume full day classes. 

Primary schools will be able to hold classes all day from December 1 as long as at least 70 percent of pupils are double jabbed and 35 schools have so far applied to do so.

Vu said she believes more schools will make the move soon.";Radio Television Hong Kong
https://news.rthk.hk/rthk/en/component/k2/1674750-20221108.htm;2022-11-08 21:06:00; Another melioidosis patient dies: CHP All Local Greater China World News Finance Sport;" Officials say the victim had suffered from a number of chronic illnesses, including colon cancer, and ischemic heart disease. File photo: RTHK Health officials on Tuesday said an elderly man infected with melioidosis died on Monday, becoming the ninth death involving a patient with the disease in Hong Kong this year. 

The man, 89, had suffered from a number of chronic illnesses, including colon cancer, ischemic heart disease and ischemic stroke. 

He lived in Sham Shui Po and had been in hospital since October 8. 

The Centre for Health Protection said among 34 patients infected with the disease this year, two remain in hospital and 23 had been discharged.

It stressed melioidosis normally is not transmitted between people or animals but people can be infected through contact with contaminated soil and surface waters.";Radio Television Hong Kong
https://news.rthk.hk/rthk/en/component/k2/1674733-20221108.htm;2022-11-08 18:20:00; Govt mulls banning cigarettes for future generations All Local Greater China World News Finance Sport;" Govt mulls banning cigarettes for future generations Health minister Lo Chung mau said on Tuesday the government is considering completely banning future generations from buying tobacco products. 

He said one of the ways to go about this would be to raise the minimum legal age for buying cigarettes, saying the government's goal is to keep young people from getting addicted to smoking. 

The minister said the government may refer to the experience of other places when introducing further measures against smoking, adding officials will conduct a public consultation exercise on the matter. 

We may continuously legislate to raise the minimum legal age for buying tobacco products, so that our future generations will stay away from tobacco products forever, he said in a speech at a seminar on tobacco control.

Lo said the city's smoking rate is at 9.5 percent at the moment – down from 23 percent in the early 1980s. 

In order to achieve the government's target of 7.8 percent or lower in 2025, he said more proactive measures are needed to deter people from smoking.";Radio Television Hong Kong
